{
  "protocol_version": "0.1",
  "request_id": "llm-review-agent-001",
  "run_id": "agent-001",
  "task": "llm_translation_reflection",
  "source_locale": "en-US",
  "target_locale": "zh-CN",
  "instructions": [
    "Review the draft translations for meaning, fluency, terminology, locale fit, and placeholder safety.",
    "Return actionable segment-level issues only."
  ],
  "output_contract": {
    "format": "json",
    "shape": {
      "issues": ["segment_id", "severity", "category", "message", "confidence", "suggested_target?"]
    },
    "segment_id_policy": "must_reference_request_segments"
  },
  "deterministic_findings": [],
  "segments": [
    {
      "segment_id": "seg-menu-start",
      "source_path": "app/src/main/res/values/strings.xml",
      "source": "Start game",
      "target": "开始游戏",
      "context": { "resource_name": "menu_start" },
      "constraints": { "placeholders": [] }
    }
  ],
  "summary": {
    "segment_count": 1,
    "total_generated_segment_count": 1,
    "deterministic_finding_count": 0,
    "truncated": false
  }
}
